{
  "$schema": "http://json-schema.org/draft-07/schema#",
  "title": "OpenCoT Reasoning Trace v0.1",
  "type": "object",
  "properties": {
    "version": {
      "type": "string",
      "enum": [
        "0.1"
      ]
    },
    "task": {
      "type": "string"
    },
    "steps": {
      "type": "array",
      "items": {
        "type": "object",
        "properties": {
          "id": {
            "type": "string"
          },
          "type": {
            "type": "string"
          },
          "content": {
            "type": "string"
          },
          "parent": {
            "oneOf": [
              {
                "type": "string"
              },
              {
                "type": "array",
                "items": {
                  "type": "string"
                }
              }
            ]
          },
          "children": {
            "type": "array",
            "items": {
              "type": "string"
            }
          },
          "evidence": {
            "type": "array",
            "items": {
              "type": "string"
            }
          },
          "confidence": {
            "type": "number",
            "minimum": 0,
            "maximum": 1
          },
          "verification_status": {
            "type": "string",
            "enum": [
              "verified",
              "failed",
              "unknown"
            ]
          },
          "verifier_score": {
            "type": "number"
          }
        },
        "required": [
          "id",
          "type",
          "content"
        ]
      }
    },
    "final_answer": {
      "type": "string"
    }
  },
  "required": [
    "version",
    "task",
    "steps",
    "final_answer"
  ],
  "$id": "https://opencot.dev/schemas/rfc-0001-reasoning.json",
  "x-opencot": {
    "rfc": "0001",
    "shortname": "reasoning",
    "source_rfc": "rfcs/0001-initial-schema.md"
  }
}
