{
  "version": "0.1",
  "task": "Find the population of Tokyo and compute its square root.",
  "steps": [
    {
      "id": "s1",
      "type": "thought",
      "content": "I should call the search tool to get Tokyo's population."
    },
    {
      "id": "s2",
      "type": "action",
      "content": "call:search",
      "tool_invocation": {
        "tool_name": "search",
        "arguments": { "query": "population of Tokyo" },
        "triggered_by_step": "s1"
      }
    },
    {
      "id": "s3",
      "type": "observation",
      "content": "{\"population\": 13960000}",
      "parent": "s2"
    },
    {
      "id": "s4",
      "type": "calculation",
      "content": "sqrt(13960000) ≈ 3736.0",
      "parent": "s3"
    }
  ],
  "final_answer": "The square root of Tokyo's population (~13.96M) is approximately 3736."
}
