{
  "version": "0.1",
  "task": "What is 17 * 23?",
  "steps": [
    {
      "id": "s1",
      "type": "thought",
      "content": "Break 23 into 20 + 3."
    },
    {
      "id": "s2",
      "type": "calculation",
      "content": "17 * 20 = 340",
      "parent": "s1"
    },
    {
      "id": "s3",
      "type": "calculation",
      "content": "17 * 3 = 51",
      "parent": "s1"
    }
  ],
  "final_answer": "391"
}
